<?xml version="1.0" encoding="utf-8"?>
<!DOCTYPE dataset SYSTEM "src/test/resources/cahschema.dtd">
<dataset>
    <T_user ID="0" NAME="First" ACTIVE="true" LANG_ID="es"/>
    <T_user ID="1" NAME="Second" ACTIVE="true" LANG_ID="es"/>
    <T_user ID="2" NAME="Third" ACTIVE="false" LANG_ID="es"/>
    <T_user ID="3" NAME="Fourth" ACTIVE="true" LANG_ID="es"/>
    <T_user ID="4" NAME="Fifth" ACTIVE="true" LANG_ID="es"/>
    <T_user ID="5" NAME="Sixth" ACTIVE="true" LANG_ID="es"/>
    <T_user ID="6" NAME="Seventh" ACTIVE="true" LANG_ID="es"/>
</dataset>